source_title,author,year_or_period,source_type,term_or_phrase,sense,source_url,usable_for_public_page,notes
A Treatise of Schemes and Tropes,Richard Sherry,1550,primary_text,artificiall/vnartificial proofs,technical_rule_reckoning,https://www.gutenberg.org/files/28447/28447-h/28447-h.htm,yes,Best public-domain pre-1828 rhetorical anchor.
The Arte of Rhetorique,Thomas Wilson,1553,primary_text,artificiall memory,technical_rule_reckoning,https://ota.bodleian.ox.ac.uk/repository/xmlui/bitstream/handle/20.500.12024/3153/3153.html?isAllowed=y&sequence=6,yes_with_care,Good early English memory anchor; early spelling needs careful transcription.
The Castel of Memorie,William Fulwood,1562,primary_text / secondary quotation located,Artificiall Memorie,technical_rule_reckoning,https://deepblue.lib.umich.edu/bitstream/handle/2027.42/99866/bozio_1.pdf?sequence=1,needs_review,Need direct public-domain text if used publicly.
Mirifici Logarithmorum Canonis Constructio / Napier summaries,John Napier,1619 / written earlier,secondary_scholarly,artificial numbers,technical_rule_reckoning,https://old.maa.org/press/periodicals/convergence/napiers-binary-chessboard-calculator-napier-and-logarithms,yes_with_care,Use as history-of-math support; primary text optional.
A Dictionary of the English Language,Samuel Johnson,1755/1773,historical_dictionary,artificial; artifice,mixed_bridge_sense,https://johnsonsdictionaryonline.com/views/search.php?term=artificial,needs_review,Direct source still needs manual capture.
