modern_term,variant_spelling,source_found,year_or_period,source_url,status,notes
artificial,artificial,Etymonline; Merriam-Webster; Johnson secondary,late 14c./15th c. claimed,https://www.etymonline.com/word/artificial,confirmed,Modern spelling appears in historical/lexical tradition.
artificial,artificall,Sherry/Wilson/Fulwood phrase evidence,1550s,https://www.gutenberg.org/files/28447/28447-h/28447-h.htm,confirmed,Early spelling in artificiall/vnartificial proofs and artificiall memory contexts.
artificial,artificiale,Latin/French family context,medieval/Latin,https://www.etymonline.com/word/artificial,possible,Not captured as English snippet.
artificial,artificiel,Old French / modern French etymology,Old French,https://www.etymonline.com/word/artificial,possible,"Source language form, not English Chart 1 evidence."
artificially,artificially,Etymonline,early 15c. claimed,https://www.etymonline.com/word/artificially,confirmed,Adverbial art/skill/contrivance evidence.
artificially,artificiallie,search attempted,N/A,,not_found,No useful source found.
artifice,artifice,Etymonline; Johnson secondary,1530s claimed; 1755 Johnson secondary,https://www.etymonline.com/word/artifice,confirmed,Word-family bridge.
artificer,artificer,Etymonline; MW,late 14c. claimed,https://www.etymonline.com/word/artificer,possible,"Strong lexical claim, no direct pre-1828 primary snippet captured."
artificial memory,artificiall memory / Artificiall Memorie,Wilson/Fulwood,1553/1562,https://ota.bodleian.ox.ac.uk/repository/xmlui/bitstream/handle/20.500.12024/3153/3153.html?isAllowed=y&sequence=6,confirmed,Strong pre-1828 learned-technique phrase.
