question,status,strongest_evidence,remaining_gap,ready_for_visual_planning,notes
Does artificial have early negative potential?,mostly_ready,Etymonline chronology; Shakespeare artificial tears; Wollstonecraft artificial manners; Johnson indirect,OED and direct Johnson verification,false,"Evidence is good, but exact chronology is not final."
Does artificial show affected/insincere usage?,mostly_ready,Wollstonecraft artificial manners; Etymonline artificiality/artificial,"More snippets for artificial smile, artificial expression, artificially affected",false,"Good domain, thin breadth."
Does artificial show false emotion usage?,partial,Shakespeare artificial tears; existing Ngram artificial smile/tears signals,"More contextual snippets for smile, feeling, emotion, sentiment",false,Strong single early anchor.
Does artificial become consumer-suspicious?,partial,1904 artificially colored lead; 1969-1976 artificial sweetener discourse; modern consumer reports,Broader historical advertising and magazine evidence,false,Promising but uneven before modern period.
Do absence claims intensify negative value?,mostly_ready,1950 no artificial flavoring ad; 2026 FDA no artificial colors; Gatorade; Swanson,More 1950-2019 packaging/advertising examples,true,"Strongest Chart 4A lane, especially after 2019."
"Is the trajectory linear, wave-like, or spiral?",partial,Early split plus later consumer/absence reactivation,More 1850-2000 evidence and direct lexicographic review,false,Spiral/domain transfer looks promising; linear model looks weak.
Can Chart 4A connect to Chart 4B?,mostly_ready,Johnson/Webster distinctions; Consumer Reports natural/artificial; Cambridge/Oxford/WordReference comparator sources,Dedicated semantic-distance/collocation pass,false,Good guardrails; Chart 4B still needs its own evidence pass.
